{
  "$schema": "https://json-schema.org/draft/2020-12/schema",
  "$id": "https://modyra.dev/schemas/dynamic-form-v2.schema.json",
  "title": "Modyra Dynamic Form Contract v2",
  "description": "Shape of a v2 document: v3's vocabulary without a placement slot or a section's per-size placement, both of which the parser refuses below v3. A document this schema accepts may still be rejected by the parser: JSON Schema cannot express a cross-reference, so a layout slot naming a field that does not exist, a duplicate field name, or a validation reading an undeclared path all pass here and fail there. Run scripts/audit-contract-schema.mjs for what each side is responsible for.",
  "type": "object",
  "additionalProperties": false,
  "required": [
    "version"
  ],
  "properties": {
    "version": {
      "const": 2
    },
    "id": {
      "type": "string",
      "minLength": 1
    },
    "fields": {
      "type": "array",
      "items": {
        "$ref": "#/$defs/field"
      }
    },
    "layout": {
      "type": "array",
      "items": {
        "$ref": "#/$defs/layout"
      }
    },
    "rules": {
      "type": "array",
      "items": {
        "$ref": "#/$defs/rule"
      }
    },
    "validations": {
      "type": "array",
      "items": {
        "$ref": "#/$defs/validation"
      }
    },
    "schema": {
      "$ref": "#/$defs/node"
    }
  },
  "$defs": {
    "breakpoint": {
      "enum": [
        "base",
        "sm",
        "md",
        "lg"
      ]
    },
    "trackCountAt": {
      "type": "object",
      "additionalProperties": false,
      "propertyNames": {
        "$ref": "#/$defs/breakpoint"
      },
      "properties": {
        "base": {
          "type": "integer",
          "minimum": 1,
          "maximum": 12
        },
        "sm": {
          "type": "integer",
          "minimum": 1,
          "maximum": 12
        },
        "md": {
          "type": "integer",
          "minimum": 1,
          "maximum": 12
        },
        "lg": {
          "type": "integer",
          "minimum": 1,
          "maximum": 12
        }
      }
    },
    "validators": {
      "type": "object",
      "additionalProperties": false,
      "properties": {
        "required": {
          "type": "boolean"
        },
        "email": {
          "type": "boolean"
        },
        "min": {
          "type": "number"
        },
        "max": {
          "type": "number"
        },
        "minLength": {
          "type": "number"
        },
        "maxLength": {
          "type": "number"
        },
        "pattern": {
          "type": "string",
          "maxLength": 256
        }
      }
    },
    "option": {
      "type": "object",
      "additionalProperties": false,
      "required": [
        "value",
        "label"
      ],
      "properties": {
        "value": {
          "type": [
            "string",
            "number",
            "boolean",
            "object"
          ]
        },
        "label": {
          "type": "string"
        },
        "disabled": {
          "type": "boolean"
        }
      }
    },
    "field": {
      "type": "object",
      "required": [
        "name",
        "kind"
      ],
      "properties": {
        "name": {
          "type": "string",
          "minLength": 1,
          "not": {
            "enum": [
              "__proto__",
              "prototype",
              "constructor"
            ]
          },
          "pattern": "^[^.]+$"
        },
        "kind": {
          "enum": [
            "text",
            "textarea",
            "email",
            "password",
            "number",
            "slider",
            "checkbox",
            "toggle",
            "select",
            "radio",
            "multiselect",
            "segmented",
            "datepicker",
            "daterange",
            "timepicker",
            "file",
            "colors"
          ]
        },
        "label": {
          "type": "string"
        },
        "ariaLabel": {
          "type": "string"
        },
        "placeholder": {
          "type": "string"
        },
        "sensitive": {
          "type": "boolean"
        },
        "initialValue": {},
        "validators": {
          "$ref": "#/$defs/validators"
        },
        "min": {
          "type": "number"
        },
        "max": {
          "type": "number"
        },
        "step": {
          "type": "number",
          "exclusiveMinimum": 0
        },
        "options": {
          "type": "array",
          "items": {
            "$ref": "#/$defs/option"
          }
        }
      },
      "allOf": [
        {
          "if": {
            "properties": {
              "kind": {
                "enum": [
                  "select",
                  "radio",
                  "multiselect",
                  "segmented"
                ]
              }
            }
          },
          "then": {
            "required": [
              "options"
            ]
          }
        }
      ]
    },
    "layoutChild": {
      "oneOf": [
        {
          "type": "string"
        },
        {
          "$ref": "#/$defs/layout"
        }
      ]
    },
    "layout": {
      "oneOf": [
        {
          "type": "object",
          "additionalProperties": false,
          "required": [
            "kind",
            "id",
            "children"
          ],
          "properties": {
            "kind": {
              "const": "section"
            },
            "id": {
              "type": "string"
            },
            "label": {
              "type": "string"
            },
            "children": {
              "type": "array",
              "items": {
                "$ref": "#/$defs/layoutChild"
              }
            }
          }
        },
        {
          "type": "object",
          "additionalProperties": false,
          "required": [
            "kind",
            "id",
            "columns"
          ],
          "properties": {
            "kind": {
              "const": "columns"
            },
            "id": {
              "type": "string"
            },
            "at": {
              "$ref": "#/$defs/trackCountAt"
            },
            "columns": {
              "type": "array",
              "items": {
                "type": "array",
                "items": {
                  "$ref": "#/$defs/layoutChild"
                }
              }
            }
          }
        }
      ]
    },
    "rule": {
      "type": "object",
      "additionalProperties": false,
      "required": [
        "effect",
        "target",
        "when"
      ],
      "properties": {
        "effect": {
          "enum": [
            "visible",
            "hidden",
            "enabled",
            "disabled"
          ]
        },
        "target": {
          "type": "string"
        },
        "when": {
          "type": "object",
          "additionalProperties": false,
          "required": [
            "field",
            "operator"
          ],
          "properties": {
            "field": {
              "type": "string"
            },
            "operator": {
              "enum": [
                "equals",
                "notEquals",
                "in",
                "notIn",
                "isEmpty",
                "isNotEmpty",
                "greaterThan",
                "greaterThanOrEqual",
                "lessThan",
                "lessThanOrEqual"
              ]
            },
            "value": {}
          },
          "allOf": [
            {
              "if": {
                "properties": {
                  "operator": {
                    "enum": [
                      "in",
                      "notIn"
                    ]
                  }
                },
                "required": [
                  "operator"
                ]
              },
              "then": {
                "required": [
                  "value"
                ],
                "properties": {
                  "value": {
                    "type": "array"
                  }
                }
              }
            },
            {
              "if": {
                "properties": {
                  "operator": {
                    "enum": [
                      "greaterThan",
                      "greaterThanOrEqual",
                      "lessThan",
                      "lessThanOrEqual"
                    ]
                  }
                },
                "required": [
                  "operator"
                ]
              },
              "then": {
                "required": [
                  "value"
                ],
                "properties": {
                  "value": {
                    "type": [
                      "number",
                      "string"
                    ]
                  }
                }
              }
            }
          ]
        }
      }
    },
    "validation": {
      "type": "object",
      "additionalProperties": false,
      "required": [
        "when",
        "message"
      ],
      "properties": {
        "when": {
          "description": "An expression tree. Its shape is the parser's to judge: a schema that described it would be a second definition of the expression language.",
          "type": "object"
        },
        "message": {
          "type": "string",
          "minLength": 1
        },
        "target": {
          "type": "string",
          "minLength": 1
        }
      }
    },
    "fieldNode": {
      "type": "object",
      "additionalProperties": false,
      "required": [
        "node",
        "field"
      ],
      "properties": {
        "node": {
          "const": "field"
        },
        "field": {
          "$ref": "#/$defs/field"
        }
      }
    },
    "groupNode": {
      "type": "object",
      "additionalProperties": false,
      "required": [
        "node",
        "children"
      ],
      "properties": {
        "node": {
          "const": "group"
        },
        "label": {
          "type": "string"
        },
        "children": {
          "type": "object",
          "propertyNames": {
            "pattern": "^[^.]+$"
          },
          "additionalProperties": {
            "$ref": "#/$defs/node"
          }
        }
      }
    },
    "arrayNode": {
      "type": "object",
      "additionalProperties": false,
      "required": [
        "node",
        "item"
      ],
      "properties": {
        "node": {
          "const": "array"
        },
        "label": {
          "type": "string"
        },
        "item": {
          "oneOf": [
            {
              "$ref": "#/$defs/fieldNode"
            },
            {
              "$ref": "#/$defs/groupNode"
            },
            {
              "$ref": "#/$defs/recordNode"
            },
            {
              "$ref": "#/$defs/arrayNode"
            }
          ],
          "description": "A row's shape, a collection of either kind included. A row's descendants are addressed below this array's index, and a collection the row declares names its own rows the same way, so a second positional level is as addressable as the first (ADR 0043)."
        },
        "initialValue": {
          "type": "array",
          "maxItems": 100
        },
        "minItems": {
          "type": "integer",
          "minimum": 0
        },
        "maxItems": {
          "type": "integer",
          "minimum": 0
        }
      }
    },
    "recordNode": {
      "type": "object",
      "additionalProperties": false,
      "required": [
        "node",
        "item"
      ],
      "properties": {
        "node": {
          "const": "record"
        },
        "label": {
          "type": "string"
        },
        "item": {
          "oneOf": [
            {
              "$ref": "#/$defs/fieldNode"
            },
            {
              "$ref": "#/$defs/groupNode"
            },
            {
              "$ref": "#/$defs/recordNode"
            },
            {
              "$ref": "#/$defs/arrayNode"
            }
          ],
          "description": "A row's shape, a collection of either kind included: keys address a row, so nothing below one moves."
        },
        "initialValue": {
          "type": "object",
          "propertyNames": {
            "pattern": "^[^.]+$"
          },
          "maxProperties": 100
        }
      }
    },
    "node": {
      "oneOf": [
        {
          "$ref": "#/$defs/fieldNode"
        },
        {
          "$ref": "#/$defs/groupNode"
        },
        {
          "$ref": "#/$defs/arrayNode"
        },
        {
          "$ref": "#/$defs/recordNode"
        }
      ]
    }
  },
  "oneOf": [
    {
      "required": [
        "fields"
      ]
    },
    {
      "required": [
        "schema"
      ]
    }
  ]
}
