{"version":2,"id":"business-signup","fields":[{"name":"customerType","kind":"select","options":[{"value":"private","label":"Private"},{"value":"business","label":"Business"}]},{"name":"vatNumber","kind":"text"}],"layout":[{"kind":"section","id":"identity","children":["customerType","vatNumber"]}],"rules":[{"effect":"visible","target":"vatNumber","when":{"field":"customerType","operator":"equals","value":"business"}}]}
